{
  "schemaVersion": "1.1",
  "app": "requestflow",
  "source": {
    "commit": "11f78cdab0e2b4a4b2e92de4bcace444502de158",
    "documents": [
      {
        "path": "specs/requestflow/requirements.md",
        "title": "RequestFlow — Business Requirements v1.2",
        "gitBlobSha": "5f982fdf278dcd0fdf07c171deb4995224e59f6b"
      },
      {
        "path": "specs/requestflow/test-plan.md",
        "title": "RequestFlow — Test Plan v1",
        "gitBlobSha": "1db83b52060785895316bab7e9f9fed37badfb6e"
      }
    ],
    "discovery": {
      "method": "playwright test --list --reporter=json",
      "testDir": "tests",
      "playwrightVersion": "1.63.0"
    }
  },
  "requirements": [
    {
      "id": "REQ-001",
      "title": "Create a request",
      "markdown": "An Employee must be able to create a new request.\n\n`POST /api/requests`\n\n### Acceptance criteria\n\n- The payload accepts only `title`, `description` and `amount`.\n- Title, description and amount are validated according to [Validation rules](#validation-rules).\n- An invalid payload is not accepted, no request is created, and the API returns `400` with\n  `VALIDATION_ERROR`.\n- A successfully created request receives a unique ID.\n- A newly created request has status `DRAFT` and `reviewComment` `null`.\n- The authenticated Employee becomes the requester.\n- `createdAt` and `updatedAt` are set at creation.\n- Success returns `201` with the created Request.\n- Only an Employee can create a request; a Reviewer receives `403` with `FORBIDDEN`.",
      "automationLinkage": {
        "status": "linked",
        "testInstanceIds": [
          "1061e5c39dd1405d2468-0029740d66f14f48a6bf",
          "1061e5c39dd1405d2468-081a80f537ce0cd7bad3",
          "1061e5c39dd1405d2468-0e36bec6bd261e50f34e",
          "1061e5c39dd1405d2468-28e84d34aa59dd14a6d2",
          "1061e5c39dd1405d2468-2af64a9e4742cb0070cf",
          "1061e5c39dd1405d2468-304cb5c111d0e8b08791",
          "1061e5c39dd1405d2468-4341e019a3ce5e8955a1",
          "1061e5c39dd1405d2468-50018e4efa6bf594d35d",
          "1061e5c39dd1405d2468-53c592e8ecb8600ca7b3",
          "1061e5c39dd1405d2468-55879742c377c405bc84",
          "1061e5c39dd1405d2468-7e7bca9699870643cf14",
          "1061e5c39dd1405d2468-985b945458062a36a736",
          "1061e5c39dd1405d2468-9b0ed3d196e2789e2cf9",
          "1061e5c39dd1405d2468-9e6e5e39f4f9bd4817de",
          "1061e5c39dd1405d2468-a2ff678d294fe5059bf4",
          "1061e5c39dd1405d2468-a6b88d437de6c3072e37",
          "1061e5c39dd1405d2468-bbb63565d826abc0b399",
          "1061e5c39dd1405d2468-bd237da79beb63ec7e63",
          "1061e5c39dd1405d2468-c39bc49b4b1bce49f0ea",
          "1061e5c39dd1405d2468-cb88917b902dd5ef9609",
          "1061e5c39dd1405d2468-d486fd8111a13da2db4a",
          "1061e5c39dd1405d2468-ded6cff1eccdc326a426",
          "1061e5c39dd1405d2468-ec36eb666b349ae3c95c",
          "1061e5c39dd1405d2468-f62c47037ea17fba3b15",
          "ecbdf010184b3bc3f097-7c494ef8bacad9964b74"
        ]
      }
    },
    {
      "id": "REQ-002",
      "title": "Edit a draft request",
      "markdown": "An Employee must be able to edit their own request while it is in `DRAFT`.\n\n`PATCH /api/requests/:id`\n\n### Acceptance criteria\n\n- The update is partial: any non-empty subset of `title`, `description` and `amount` may be\n  provided. Fields not provided keep their current values.\n- An empty payload `{}` returns `400` with `VALIDATION_ERROR`.\n- A system-managed or unknown field returns `400` with `VALIDATION_ERROR`.\n- Every provided field is validated according to [Validation rules](#validation-rules);\n  an invalid value returns `400` with `VALIDATION_ERROR` and the request is not changed.\n- Only the owner of a `DRAFT` request may edit it.\n- Editing a request that is not in `DRAFT` returns `409` with `INVALID_STATE_TRANSITION`.\n- An Employee attempting to edit another Employee's request receives `404` with `NOT_FOUND`.\n- A Reviewer attempting to edit any request receives `403` with `FORBIDDEN`.\n- A successful edit updates `updatedAt`.\n- Success returns `200` with the updated Request.",
      "automationLinkage": {
        "status": "linked",
        "testInstanceIds": [
          "087c0c5daaf3eaace47a-22d711a040c319d80aff",
          "087c0c5daaf3eaace47a-695ceee24d333d8f1b27",
          "087c0c5daaf3eaace47a-a6eacbb62fbd50bea1fe"
        ]
      }
    },
    {
      "id": "REQ-003",
      "title": "Submit a request",
      "markdown": "An Employee must be able to submit their own `DRAFT` request for review.\n\n`PATCH /api/requests/:id/submit`\n\n### Acceptance criteria\n\n- Only a `DRAFT` request can be submitted; submitting a request in any other status returns\n  `409` with `INVALID_STATE_TRANSITION`.\n- Submission changes the status from `DRAFT` to `SUBMITTED`.\n- Submission updates `updatedAt`.\n- Success returns `200` with the updated Request.\n- A submitted request appears in the review queue (REQ-004).\n- A submitted request can no longer be edited by the requester (REQ-002).\n- An Employee attempting to submit another Employee's request receives `404` with `NOT_FOUND`.\n- A Reviewer attempting to submit any request receives `403` with `FORBIDDEN`.",
      "automationLinkage": {
        "status": "linked",
        "testInstanceIds": [
          "0e5cd8cf2b0905c1f51a-951d48748bcdfde8685b",
          "41cbdbb58a8f35bcb11b-3d0e63f8994afaf3507e"
        ]
      }
    },
    {
      "id": "REQ-004",
      "title": "Review queue",
      "markdown": "A Reviewer must be able to see requests waiting for review.\n\n`GET /api/review-queue`\n\n### Acceptance criteria\n\n- The review queue contains all requests with status `SUBMITTED`, from all Employees.\n- Requests with status `DRAFT`, `APPROVED` or `REJECTED` are not present in the review queue.\n- Success returns `200` with `{ \"items\": [ <Request>, ... ] }`, ordered by `createdAt`\n  descending (newest first).\n- The Reviewer can open a request from the queue and inspect its details.\n- Only a Reviewer can access the review queue; an Employee receives `403` with `FORBIDDEN`.",
      "automationLinkage": {
        "status": "linked",
        "testInstanceIds": ["0e5cd8cf2b0905c1f51a-951d48748bcdfde8685b"]
      }
    },
    {
      "id": "REQ-005",
      "title": "Approve a request",
      "markdown": "A Reviewer must be able to approve a submitted request.\n\n`PATCH /api/requests/:id/approve`\n\n### Acceptance criteria\n\n- The endpoint accepts no payload fields; any field sent returns `400` with\n  `VALIDATION_ERROR`.\n- Only a `SUBMITTED` request can be approved; approving a request with status `APPROVED` or\n  `REJECTED` returns `409` with `INVALID_STATE_TRANSITION`.\n- Approving a `DRAFT` request returns `404` with `NOT_FOUND`, because `DRAFT` requests are\n  not visible to Reviewers.\n- Approval changes the status to `APPROVED`.\n- Approval updates `updatedAt`.\n- Approval leaves `reviewComment` as `null`.\n- Success returns `200` with the updated Request.\n- `APPROVED` is a terminal state.\n- Only a Reviewer can approve; an Employee receives `403` with `FORBIDDEN`.\n- The final status is visible through both UI and API.",
      "automationLinkage": {
        "status": "linked",
        "testInstanceIds": ["0e5cd8cf2b0905c1f51a-951d48748bcdfde8685b"]
      }
    },
    {
      "id": "REQ-006",
      "title": "Reject a request",
      "markdown": "A Reviewer must be able to reject a submitted request.\n\n`PATCH /api/requests/:id/reject`\n\n### Acceptance criteria\n\n- The payload accepts only `comment`; a system-managed or unknown field returns `400` with\n  `VALIDATION_ERROR`.\n- Only a `SUBMITTED` request can be rejected; rejecting a request with status `APPROVED` or\n  `REJECTED` returns `409` with `INVALID_STATE_TRANSITION`.\n- Rejecting a `DRAFT` request returns `404` with `NOT_FOUND`, because `DRAFT` requests are\n  not visible to Reviewers.\n- A rejection comment is mandatory and is validated according to\n  [Validation rules](#rejection-comment); an invalid or missing comment returns `400` with\n  `VALIDATION_ERROR` and the request is not changed.\n- Rejection changes the status to `REJECTED` and stores the comment as `reviewComment`.\n- Rejection updates `updatedAt`.\n- Success returns `200` with the updated Request.\n- `REJECTED` is a terminal state.\n- Only a Reviewer can reject; an Employee receives `403` with `FORBIDDEN`.\n- The rejection comment is visible on the request details.\n- The final status is visible through both UI and API.",
      "automationLinkage": {
        "status": "linked",
        "testInstanceIds": ["41cbdbb58a8f35bcb11b-3d0e63f8994afaf3507e"]
      }
    },
    {
      "id": "REQ-007",
      "title": "Authorization",
      "markdown": "Business actions must respect the authenticated user's role and ownership.\n\n### Acceptance criteria\n\n- Employee-only actions (create, edit, submit, list own requests) performed by a Reviewer\n  return `403` with `FORBIDDEN`.\n- Reviewer-only actions (review queue, approve, reject) performed by an Employee return\n  `403` with `FORBIDDEN`.\n- An Employee can read and act on only their own requests. Another Employee's request is\n  treated as non-existent: `404` with `NOT_FOUND`.\n- A Reviewer can read only `SUBMITTED`, `APPROVED` and `REJECTED` requests. A `DRAFT`\n  request is treated as non-existent for a Reviewer: `404` with `NOT_FOUND`.\n- When several errors apply, the [error precedence](#error-precedence) determines the\n  response.\n- Authorization must be enforced by the application, not only by hiding UI controls.",
      "automationLinkage": {
        "status": "not-linked",
        "testInstanceIds": []
      }
    },
    {
      "id": "REQ-008",
      "title": "Request retrieval through API",